{
  "id": "Core_overview",
  "label": "Core Module Overview",
  "description": "Dashboard for browsing core entities and their relationships",
  "pages": [
    {
      "name": "",
      "wikitext": "== Core Entities Overview ==\n\nThis dashboard provides an overview of the core ontology entities.\n\n=== People ===\n{{#ask:\n [[Category:Person]]\n |?Has_name\n |?Has_email\n |format=table\n}}\n\n=== Organizations ===\n{{#ask:\n [[Category:Organization]]\n |?Has_name\n |format=table\n}}"
    },
    {
      "name": "Setup",
      "wikitext": "== Setup Guide ==\n\nTo use the Core module:\n\n# Install the Core module from Ontology Hub\n# Configure your wiki settings\n# Start creating entities\n\n[[Special:FormEdit/Person|Create a Person]] | [[Special:FormEdit/Organization|Create an Organization]]"
    }
  ]
}
